{"coordinator":{"excluded_from_worker_pool":true,"root":"/tmp/claude-0/-home-claude/f1463c68-fbe6-587f-8318-7569fadc809c/scratchpad/p7-review/rehearsal-run/coordinator","runner":"/home/claude/baseline-ws6/bin/optimization-run"},"default_node":"local-test","name":"Local test and planned home workers","nodes":[{"allow_commands":true,"declared":{"cpu_slots":1,"memory_bytes":1073741824},"enabled":true,"id":"local-test","mode":"foreground","role":"test","root":"/tmp/claude-0/-home-claude/f1463c68-fbe6-587f-8318-7569fadc809c/scratchpad/p7-review/rehearsal-run/node","transport":"local","workers":[{"executable":"/home/claude/baseline-ws6/bin/fcmaes-job-worker","id":"fcmaes"},{"executable":"/home/claude/baseline-ws6/bin/lp-ip-job-worker","id":"lp-ip"},{"executable":"/home/claude/baseline-ws6/bin/sqp-job-worker","id":"sqp"}]},{"allow_commands":false,"declared":{"cpu_slots":16,"memory_bytes":137438953472},"enabled":false,"helper":"/opt/experiment-craft/native/bin/optimization-run","host":"worker01.invalid","id":"worker-01","identity_file":"/home/research/.ssh/id_ed25519","known_hosts":"/home/research/.ssh/known_hosts","port":22,"role":"worker","root":"/srv/experiment-craft/jobs","timeout_seconds":30,"transport":"ssh","user":"research","workers":[{"executable":"/opt/experiment-craft/native/bin/fcmaes-job-worker","id":"fcmaes"},{"executable":"/opt/experiment-craft/native/bin/lp-ip-job-worker","id":"lp-ip"},{"executable":"/opt/experiment-craft/native/bin/sqp-job-worker","id":"sqp"}]},{"allow_commands":false,"declared":{"cpu_slots":16,"memory_bytes":137438953472},"enabled":false,"helper":"/opt/experiment-craft/native/bin/optimization-run","host":"worker02.invalid","id":"worker-02","identity_file":"/home/research/.ssh/id_ed25519","known_hosts":"/home/research/.ssh/known_hosts","port":22,"role":"worker","root":"/srv/experiment-craft/jobs","timeout_seconds":30,"transport":"ssh","user":"research","workers":[{"executable":"/opt/experiment-craft/native/bin/fcmaes-job-worker","id":"fcmaes"},{"executable":"/opt/experiment-craft/native/bin/lp-ip-job-worker","id":"lp-ip"},{"executable":"/opt/experiment-craft/native/bin/sqp-job-worker","id":"sqp"}]},{"allow_commands":false,"declared":{"cpu_slots":16,"memory_bytes":137438953472},"enabled":false,"helper":"/opt/experiment-craft/native/bin/optimization-run","host":"worker03.invalid","id":"worker-03","identity_file":"/home/research/.ssh/id_ed25519","known_hosts":"/home/research/.ssh/known_hosts","port":22,"role":"worker","root":"/srv/experiment-craft/jobs","timeout_seconds":30,"transport":"ssh","user":"research","workers":[{"executable":"/opt/experiment-craft/native/bin/fcmaes-job-worker","id":"fcmaes"},{"executable":"/opt/experiment-craft/native/bin/lp-ip-job-worker","id":"lp-ip"},{"executable":"/opt/experiment-craft/native/bin/sqp-job-worker","id":"sqp"}]},{"allow_commands":false,"declared":{"cpu_slots":16,"memory_bytes":137438953472},"enabled":false,"helper":"/opt/experiment-craft/native/bin/optimization-run","host":"worker04.invalid","id":"worker-04","identity_file":"/home/research/.ssh/id_ed25519","known_hosts":"/home/research/.ssh/known_hosts","port":22,"role":"worker","root":"/srv/experiment-craft/jobs","timeout_seconds":30,"transport":"ssh","user":"research","workers":[{"executable":"/opt/experiment-craft/native/bin/fcmaes-job-worker","id":"fcmaes"},{"executable":"/opt/experiment-craft/native/bin/lp-ip-job-worker","id":"lp-ip"},{"executable":"/opt/experiment-craft/native/bin/sqp-job-worker","id":"sqp"}]},{"allow_commands":false,"declared":{"cpu_slots":16,"memory_bytes":137438953472},"enabled":false,"helper":"/opt/experiment-craft/native/bin/optimization-run","host":"worker05.invalid","id":"worker-05","identity_file":"/home/research/.ssh/id_ed25519","known_hosts":"/home/research/.ssh/known_hosts","port":22,"role":"worker","root":"/srv/experiment-craft/jobs","timeout_seconds":30,"transport":"ssh","user":"research","workers":[{"executable":"/opt/experiment-craft/native/bin/fcmaes-job-worker","id":"fcmaes"},{"executable":"/opt/experiment-craft/native/bin/lp-ip-job-worker","id":"lp-ip"},{"executable":"/opt/experiment-craft/native/bin/sqp-job-worker","id":"sqp"}]},{"allow_commands":false,"declared":{"cpu_slots":16,"memory_bytes":137438953472},"enabled":false,"helper":"/opt/experiment-craft/native/bin/optimization-run","host":"worker06.invalid","id":"worker-06","identity_file":"/home/research/.ssh/id_ed25519","known_hosts":"/home/research/.ssh/known_hosts","port":22,"role":"worker","root":"/srv/experiment-craft/jobs","timeout_seconds":30,"transport":"ssh","user":"research","workers":[{"executable":"/opt/experiment-craft/native/bin/fcmaes-job-worker","id":"fcmaes"},{"executable":"/opt/experiment-craft/native/bin/lp-ip-job-worker","id":"lp-ip"},{"executable":"/opt/experiment-craft/native/bin/sqp-job-worker","id":"sqp"}]}],"placement":"explicit","schema_version":"experiment.deployment/0.1"}
